{"$schema":"https://json-schema.org/draft/2020-12/schema","$id":"https://shieldkit-labs.local/p2/gate-b/cohort-attempt-accounting-v1/attempt-accounting-root.v1.schema.json","type":"object","additionalProperties":false,"required":["schema","accountingId","status","evidenceClassification","executionAllowed","metricsAllowed","ranking","selection","attemptIndex","receiptBinding","schemaSet","contentDigest"],"properties":{"schema":{"const":"shieldkit-labs/p2/gate-b/cohort-attempt-accounting-v1/root"},"accountingId":{"const":"attempt-accounting:cohort-execution-v2:attempt-000:v1"},"status":{"const":"unattested-aborted-invocation"},"evidenceClassification":{"const":"operator-recorded-post-hoc-non-evidence"},"executionAllowed":{"const":false},"metricsAllowed":{"const":false},"ranking":{"type":"null"},"selection":{"type":"null"},"attemptIndex":{"const":0},"receiptBinding":{"$ref":"#/$defs/binding"},"schemaSet":{"type":"array","minItems":10,"maxItems":10,"prefixItems":[{"$ref":"#/$defs/schemaPin"},{"$ref":"#/$defs/schemaPin"},{"$ref":"#/$defs/schemaPin"},{"$ref":"#/$defs/schemaPin"},{"$ref":"#/$defs/schemaPin"},{"$ref":"#/$defs/schemaPin"},{"$ref":"#/$defs/schemaPin"},{"$ref":"#/$defs/schemaPin"},{"$ref":"#/$defs/schemaPin"},{"$ref":"#/$defs/schemaPin"}],"items":false},"contentDigest":{"$ref":"#/$defs/digest"}},"$defs":{"sha":{"type":"string","pattern":"^[0-9a-f]{64}$"},"digest":{"type":"object","additionalProperties":false,"required":["algorithm","canonicalization","domain","frame","value"],"properties":{"algorithm":{"const":"sha256"},"canonicalization":{"const":"recursive-lexicographic-object-key-sort-arrays-preserve-order-json-utf8-lf-v1"},"domain":{"type":"string"},"frame":{"const":"utf8(domain)||0x00||canonical-json-utf8"},"value":{"$ref":"#/$defs/sha"}}},"binding":{"type":"object","additionalProperties":false,"required":["path","rawSha256","contentDigest"],"properties":{"path":{"const":"receipts/attempt-000.posthoc-abort-receipt.v1.json"},"rawSha256":{"$ref":"#/$defs/sha"},"contentDigest":{"$ref":"#/$defs/digest"}}},"schemaPin":{"type":"object","additionalProperties":false,"required":["path","rawSha256","schemaIdentity"],"properties":{"path":{"type":"string","minLength":1},"rawSha256":{"$ref":"#/$defs/sha"},"schemaIdentity":{"type":"string","minLength":1}}}}}
