{
  "accountingId": "attempt-accounting:cohort-execution-v2:attempt-000:v1",
  "attemptIndex": 0,
  "contentDigest": {
    "algorithm": "sha256",
    "canonicalization": "recursive-lexicographic-object-key-sort-arrays-preserve-order-json-utf8-lf-v1",
    "domain": "shieldkit-labs/p2/gate-b/cohort-attempt-accounting/v1/root/attempt-000",
    "frame": "utf8(domain)||0x00||canonical-json-utf8",
    "value": "3ba933af629d5639b1fc25464182a90c7c325c2e7bb522e322a9187995900792"
  },
  "evidenceClassification": "operator-recorded-post-hoc-non-evidence",
  "executionAllowed": false,
  "metricsAllowed": false,
  "ranking": null,
  "receiptBinding": {
    "contentDigest": {
      "algorithm": "sha256",
      "canonicalization": "recursive-lexicographic-object-key-sort-arrays-preserve-order-json-utf8-lf-v1",
      "domain": "shieldkit-labs/p2/gate-b/cohort-attempt-accounting/v1/receipt/attempt-000",
      "frame": "utf8(domain)||0x00||canonical-json-utf8",
      "value": "4ef3b6b0e13563d95648be98be0979314f128b76818d9608d786946c530185d2"
    },
    "path": "receipts/attempt-000.posthoc-abort-receipt.v1.json",
    "rawSha256": "a2976a238c93313cb17c628d221375dd0616b6361283f6423aa54d242a7acd39"
  },
  "schema": "shieldkit-labs/p2/gate-b/cohort-attempt-accounting-v1/root",
  "schemaSet": [
    {
      "path": "abort-receipt.v1.schema.json",
      "rawSha256": "f7e7bb5eb7c88998417e582cb9dd6d8cad536186b80e5ccf5f1f03b272559722",
      "schemaIdentity": "abort-receipt.v1.schema.json"
    },
    {
      "path": "attempt-accounting-root.v1.schema.json",
      "rawSha256": "6fc4f7b5220da0b7bb33086b58be3150dc59de5c188afa176094fcd4600df4cb",
      "schemaIdentity": "attempt-accounting-root.v1.schema.json"
    },
    {
      "path": "attempt-manifest.v1.schema.json",
      "rawSha256": "ed521b37c52bdb4033d461f162d0aca240573e0c83aedec594ec155497337ec6",
      "schemaIdentity": "attempt-manifest.v1.schema.json"
    },
    {
      "path": "causal-batch-state.v1.schema.json",
      "rawSha256": "85176646be70afaba73d4039603fa5ab0449394c5a8c1f2c348fcd955ef975ba",
      "schemaIdentity": "causal-batch-state.v1.schema.json"
    },
    {
      "path": "endpoint-stream-binding.v1.schema.json",
      "rawSha256": "290245fa0d36b30e7d9a9f029dd98927b1e135c3b39de8844e6ea318f170176c",
      "schemaIdentity": "endpoint-stream-binding.v1.schema.json"
    },
    {
      "path": "failure-manifest.v1.schema.json",
      "rawSha256": "e92e13a5c0a16c3d7299a55b6b8851b936e9a925b3055f8a63c7e9e2a0148119",
      "schemaIdentity": "failure-manifest.v1.schema.json"
    },
    {
      "path": "failure-receipt.v1.schema.json",
      "rawSha256": "e6c02b10bb55b781d9d451059e5dd0c9d5eb2b5a9fc26b0d658083c72966cd85",
      "schemaIdentity": "failure-receipt.v1.schema.json"
    },
    {
      "path": "failure-root.v1.schema.json",
      "rawSha256": "472d6ef63cd0eee79587adcb0468e3143e5e04be9949338c7c663aea743534cc",
      "schemaIdentity": "failure-root.v1.schema.json"
    },
    {
      "path": "future-endpoint.v1.schema.json",
      "rawSha256": "ddc0322ffa9d244f1d11eb2389ddb20b191669510910aeb42c521823d3fa7368",
      "schemaIdentity": "future-endpoint.v1.schema.json"
    },
    {
      "path": "manifest.v1.schema.json",
      "rawSha256": "766511fac3c049b009fa7311c643c0f6511f818d31e08c41b55f9a11ad244001",
      "schemaIdentity": "manifest.v1.schema.json"
    }
  ],
  "selection": null,
  "status": "unattested-aborted-invocation"
}
